{
  "mode": "initial",
  "summary": "Added refresh-token issuance and tests.",
  "changed_files": [
    {
      "path": "src/auth/service.ts",
      "change_type": "modified",
      "reason": "Issue refresh token."
    }
  ],
  "verification": [
    {
      "command": "npm test -- auth",
      "kind": "test",
      "status": "passed",
      "summary": "12 tests passed."
    }
  ],
  "criteria_mapping": [
    {
      "criterion": "criterion-refresh-issued",
      "status": "satisfied",
      "evidence": ["ev-tests-auth"],
      "notes": "Covered by auth tests."
    }
  ],
  "scope_notes": {
    "status": "within_scope",
    "out_of_scope_paths": [],
    "explanation": ""
  },
  "unresolved_issues": [],
  "residual_risks": [],
  "recommended_evaluator_focus": ["backwards compatibility"]
}
